<?xml version="1.0" encoding="utf-8" ?>
<Document>
 <System>
  <TimeStamp>01/06/2025 04:00:07</TimeStamp>
  <HoofdQWaarde>R</HoofdQWaarde>
  <Firma>FAMA_&amp;_FILS_SRL_____</Firma>
  <Users>5</Users>
  <Jobs>0</Jobs>
  <QWaarden>
    <LD>
      <AfdrukNaam>FAMA &amp; FILS SPRL     </AfdrukNaam>
      <FirmaNaam>FAMA &amp; FILS SPRL     </FirmaNaam>
      <Modules>1111111   0 10  0      1    1 1 1        1       11              0    1</Modules>
      <Merk>REN,RENAULT,Renault</Merk>
      <LaatsteAfgeslotenJaar>24000\2000.12\1999.12\23988\1999.12\1998.12\23976\1998.12\1997.12\23964\1997.12\1996.12\23952\1996.12\1995.12</LaatsteAfgeslotenJaar>
      <LaatsteAfgeslotenMaand>2000.11</LaatsteAfgeslotenMaand>
      <Locaties>0</Locaties>
      <MSDos></MSDos>
      <MenuCount-202405>
      </MenuCount-202405>
    </LD>
    <R>
      <AfdrukNaam>FAMA &amp; FILS SRL     </AfdrukNaam>
      <FirmaNaam>FAMA &amp; FILS SPRL</FirmaNaam>
      <Modules>1111111 1 0011 101 11  1    1 1 1        1       11              011  1 1</Modules>
      <Merk>REN,RENAULT,Renault</Merk>
      <LaatsteAfgeslotenJaar>24288\2024.12\2023.12\24276\2023.12\2022.12\24264\2022.12\2021.12\24252\2021.12\2020.12\24240\2020.12\2019.12\24228\2019.12\2018.12\24216\2018.12\2017.12\24204\2017.12\2016.12\24192\2016.12\2015.12\24180\2015.12\2014.12\24168\2014.12\2013.12</LaatsteAfgeslotenJaar>
      <LaatsteAfgeslotenMaand>2024.11</LaatsteAfgeslotenMaand>
      <Locaties>0</Locaties>
      <MSDos></MSDos>
      <MenuCount-202406>
        <M-1.1>207</M-1.1>
        <M-1.11>4</M-1.11>
        <M-1.2>1227</M-1.2>
        <M-1.21>1</M-1.21>
        <M-1.23>4</M-1.23>
        <M-1.3>3419</M-1.3>
        <M-1.33>3</M-1.33>
        <M-1.4>2</M-1.4>
        <M-1.7>16</M-1.7>
        <M-1.8>31</M-1.8>
        <M-2.1>6</M-2.1>
        <M-2.2>38</M-2.2>
        <M-2.3>270</M-2.3>
        <M-2.7>13</M-2.7>
        <M-2.8>51</M-2.8>
        <M-2.9>2</M-2.9>
        <M-3.1>4</M-3.1>
        <M-3.14>21</M-3.14>
        <M-3.2>4</M-3.2>
        <M-3.26>1</M-3.26>
        <M-3.3>19</M-3.3>
        <M-3.33>1</M-3.33>
        <M-3.7>22</M-3.7>
        <M-3.8>21</M-3.8>
        <M-3.9>13</M-3.9>
        <M-4.2>15</M-4.2>
        <M-4.3>18</M-4.3>
        <M-5.1>206</M-5.1>
        <M-5.2>24</M-5.2>
        <M-5.3>14</M-5.3>
        <M-5.5>29</M-5.5>
        <M-5.6>16</M-5.6>
        <M-6.1>597</M-6.1>
        <M-6.12>2</M-6.12>
        <M-6.2>18</M-6.2>
        <M-7.11>1</M-7.11>
        <M-7.23>4</M-7.23>
        <M-7.24>10</M-7.24>
        <M-7.25>2</M-7.25>
        <M-7.26>1</M-7.26>
        <M-7.3>1</M-7.3>
        <M-7.31>4</M-7.31>
        <M-7.32>2</M-7.32>
        <M-7.35>1</M-7.35>
        <M-7.8>2</M-7.8>
        <M-7.9>5</M-7.9>
        <M-8>2</M-8>
        <M-10.11>1</M-10.11>
        <M-10.21>1</M-10.21>
        <M-10.23>2</M-10.23>
        <M-10.25>2</M-10.25>
        <M-10.26>1</M-10.26>
        <M-10.29>3</M-10.29>
        <M-10.9>4</M-10.9>
        <M-12.11>1</M-12.11>
        <M-12.12>1</M-12.12>
        <M-12.3>2</M-12.3>
        <M-12.45>30</M-12.45>
        <M-12.46>4</M-12.46>
        <M-12.51>1</M-12.51>
        <M-12.53>1</M-12.53>
        <M-12.8>1</M-12.8>
        <M-14.3>1</M-14.3>
        <M-14.5>1</M-14.5>
        <M-14.6>4</M-14.6>
        <M-21.1>5343</M-21.1>
        <M-21.11>262</M-21.11>
        <M-21.12>4</M-21.12>
        <M-21.13>28</M-21.13>
        <M-21.14>3</M-21.14>
        <M-21.2>617</M-21.2>
        <M-21.21>3</M-21.21>
        <M-21.23>11</M-21.23>
        <M-21.25>1121</M-21.25>
        <M-21.3>98</M-21.3>
        <M-21.31>15</M-21.31>
        <M-21.32>4</M-21.32>
        <M-21.33>1</M-21.33>
        <M-21.5>1</M-21.5>
        <M-21.6>2</M-21.6>
        <M-22.11>392</M-22.11>
        <M-22.2>559</M-22.2>
        <M-22.3>13909</M-22.3>
        <M-22.4>2</M-22.4>
        <M-22.6>2</M-22.6>
        <M-22.8>122</M-22.8>
        <M-22.9>1126</M-22.9>
        <M-23.11>2</M-23.11>
        <M-23.2>962</M-23.2>
        <M-23.26>598</M-23.26>
        <M-23.28>9</M-23.28>
        <M-23.3>6127</M-23.3>
        <M-23.31>1919</M-23.31>
        <M-23.4>1</M-23.4>
        <M-23.9>1</M-23.9>
        <M-24.11>420</M-24.11>
        <M-25.1>2457</M-25.1>
        <M-25.2>14</M-25.2>
        <M-25.3>18</M-25.3>
        <M-25.4>8</M-25.4>
        <M-25.5>38</M-25.5>
        <M-1.10>102</M-1.10>
        <M-1.12.1>27</M-1.12.1>
        <M-1.12.2>1</M-1.12.2>
        <M-1.12.3>25</M-1.12.3>
        <M-1.12.4>7</M-1.12.4>
        <M-1.23.33.9>1</M-1.23.33.9>
        <M-1.7.25>1</M-1.7.25>
        <M-1.7.30.12>2</M-1.7.30.12>
        <M-10.10.2>1</M-10.10.2>
        <M-10.10.8>2</M-10.10.8>
        <M-10.10.9>1</M-10.10.9>
        <M-10.28.1>1</M-10.28.1>
        <M-12.21.1>523</M-12.21.1>
        <M-12.21.2>290</M-12.21.2>
        <M-12.21.21>23</M-12.21.21>
        <M-12.21.3>2</M-12.21.3>
        <M-12.21.4>1</M-12.21.4>
        <M-12.21.6>4</M-12.21.6>
        <M-12.21.8>2</M-12.21.8>
        <M-12.30>8</M-12.30>
        <M-12.35.1>9</M-12.35.1>
        <M-12.35.2>1</M-12.35.2>
        <M-12.35.3>1</M-12.35.3>
        <M-12.35.4>7</M-12.35.4>
        <M-12.50>6</M-12.50>
        <M-2.10>90</M-2.10>
        <M-21.22.2>5</M-21.22.2>
        <M-21.22.22>1168</M-21.22.22>
        <M-21.22.23>1</M-21.22.23>
        <M-21.22.25>1</M-21.22.25>
        <M-21.22.3>1</M-21.22.3>
        <M-21.22.4>250</M-21.22.4>
        <M-21.22.5>10</M-21.22.5>
        <M-21.22.6>1</M-21.22.6>
        <M-21.26.23>17</M-21.26.23>
        <M-21.26.4>1</M-21.26.4>
        <M-21.41.1>6</M-21.41.1>
        <M-22.10.21>184</M-22.10.21>
        <M-22.10.22.2>1</M-22.10.22.2>
        <M-22.10.22.3>1307</M-22.10.22.3>
        <M-22.10.22.5>280</M-22.10.22.5>
        <M-22.10.3>2942</M-22.10.3>
        <M-22.10.4>195</M-22.10.4>
        <M-22.10.5>3</M-22.10.5>
        <M-22.10.9>332</M-22.10.9>
        <M-22.23.1.1>5</M-22.23.1.1>
        <M-22.23.10>266</M-22.23.10>
        <M-22.23.3>1</M-22.23.3>
        <M-23.21.2>1</M-23.21.2>
        <M-23.21.3>1</M-23.21.3>
        <M-23.33.10>2</M-23.33.10>
        <M-23.33.2>2</M-23.33.2>
        <M-23.33.27>966</M-23.33.27>
        <M-23.33.7>1</M-23.33.7>
        <M-23.33.9>213</M-23.33.9>
        <M-23.7.1>23</M-23.7.1>
        <M-23.7.2>8</M-23.7.2>
        <M-23.7.3>35</M-23.7.3>
        <M-24.25.1>63</M-24.25.1>
        <M-24.25.23>1</M-24.25.23>
        <M-24.25.7>1</M-24.25.7>
        <M-25.12.1>27</M-25.12.1>
        <M-3.10>289</M-3.10>
        <M-7.10>1</M-7.10>
        <M-7.30.1.3>1</M-7.30.1.3>
        <M-7.30.1.5>1</M-7.30.1.5>
        <M-7.30.11>1</M-7.30.11>
        <M-7.30.12>9</M-7.30.12>
        <M-7.30.14>18</M-7.30.14>
        <M-7.30.2.3>3</M-7.30.2.3>
        <M-7.30.2.5>2</M-7.30.2.5>
        <M-7.30.25>1</M-7.30.25>
        <M-7.30.27>1</M-7.30.27>
        <M-7.30.28>1</M-7.30.28>
        <M-7.30.7>1</M-7.30.7>
      </MenuCount-202406>
    </R>
    <ZZ>
      <AfdrukNaam>CAR LOCATION SA</AfdrukNaam>
      <FirmaNaam>CAR LOCATION SA</FirmaNaam>
      <Modules>1001                        1                    1               0</Modules>
      <Merk>REN,RENAULT,Renault</Merk>
      <LaatsteAfgeslotenJaar>24108\2009.12\2008.12\24096\2008.12\2007.12\24084\2007.12\2006.12\24072\2006.12\2005.12\24060\2005.12\2004.12\24048\2004.12\2003.12\24036\2003.12\2002.12\24024\2002.12\2001.12\24012\2001.12\2000.12\</LaatsteAfgeslotenJaar>
      <LaatsteAfgeslotenMaand>2009.11</LaatsteAfgeslotenMaand>
      <Locaties>0</Locaties>
      <MSDos>1</MSDos>
      <MenuCount-202503>
        <M-7.31>1</M-7.31>
      </MenuCount-202503>
    </ZZ>
  </QWaarden>
  <NameSpaces>
    <ADP>
      <AdminSocket>50000</AdminSocket>
      <STU>1\zn &quot;ADP&quot; k ^%cspSession J 1^YR898I J VGLKP^Y0350 J Download^%QCUPGREVA</STU>
    </ADP>
  </NameSpaces>
  <CacheIris>
    <Version>Cache for Windows (x86-64) 2017.2.2 (Build 865) Mon Jun 25 2018 10:45:31 EDT</Version>
    <KeyExpirationDate>25/02/2051</KeyExpirationDate>
    <KeyLicenseCapacity>Cache 2011.1 Entree - Concurrent Users for x86-64 (Microsoft Windows):8</KeyLicenseCapacity>
    <KeyEnforcedUnits>11</KeyEnforcedUnits>
    <KeyOrderNumber>202105171</KeyOrderNumber>
    <KeyCustomerName>32C00046 Garage Fama & Fils sprl - Fayt Lez Manage</KeyCustomerName>
    <KeyAuthorizationKey>11155000008000011000160001693DC03541708001</KeyAuthorizationKey>
  </CacheIris>
  <KeyDetails>
    <Lijn1>Product=Entree</Lijn1>
    <Lijn2>License Type=Concurrent User</Lijn2>
    <Lijn3>Server=Single</Lijn3>
    <Lijn4>Platform=X86-64(Windows)</Lijn4>
    <Lijn5>Licensed Users=8</Lijn5>
    <Lijn6>Enforced Users=11</Lijn6>
    <Lijn7>Licensed Cores code=16</Lijn7>
    <Lijn8>Authorized cores=16</Lijn8>
    <Lijn9>Extended feature codes=800100</Lijn9>
    <Lijn10>     Address neutral License Id rule enabled.</Lijn10>
    <Lijn11>     DeepSee Run enabled.</Lijn11>
  </KeyDetails>
  <Server>
    <BIOSVersion>American Megatrends Inc. TB1TS286, 3/09/2018</BIOSVersion>
    <BootDevice>/Device/HarddiskVolume2</BootDevice>
    <Caption>Microsoft Windows Server 2016 Standard</Caption>
    <HostName>FDC</HostName>
    <InputLocale>fr-be;French (Belgium)</InputLocale>
    <OSBuildType>Multiprocessor Free</OSBuildType>
    <OSConfiguration>Primary Domain Controller</OSConfiguration>
    <OSName>Microsoft Windows Server 2016 Standard</OSName>
    <OSVersion>10.0.14393 N/A Build 14393</OSVersion>
    <OSArchitecture>64-bit</OSArchitecture>
    <OriginalInstallDate>16/07/2019, 9:45:44</OriginalInstallDate>
    <Processors>1 Processor(s) Installed.</Processors>
    <SystemBootTime>31/05/2025, 9:55:55</SystemBootTime>
    <SystemDirectory>C:/Windows/system32</SystemDirectory>
    <SystemLocale>nl-be;Dutch (Belgium)</SystemLocale>
    <SystemManufacturer>LENOVO</SystemManufacturer>
    <SystemModel>ThinkServer TS460</SystemModel>
    <SystemType>x64-based PC</SystemType>
    <SystemDrive>C:</SystemDrive>
    <TimeZone>(UTC+01:00) Brussels, Copenhagen, Madrid, Paris</TimeZone>
    <TotalVirtualMemorySize>19043744</TotalVirtualMemorySize>
    <TotalVisibleMemorySize>16553376</TotalVisibleMemorySize>
    <WindowsDirectory>C:/Windows</WindowsDirectory>
    <IPAddress>172.19.169.221</IPAddress>
    <LocalHostName>FDC</LocalHostName>
    <FQDN>FDC.ff.local</FQDN>
    <NumberOfLogicalProcessors>8</NumberOfLogicalProcessors>
    <NumberOfProcessors>1</NumberOfProcessors>
    <NumberOfCore>4</NumberOfCore>
  </Server>
 </System>
 <Eva>
   <VER>Keyloop Eva 2024.4</VER>
   <EVA>20.03.25</EVA>
   <PATCH>20.03.25</PATCH>
   <PILOOT>17.04.25</PILOOT>
 </Eva>
 <Language>
   <Profile type="language">
     <Name>Nederlands</Name>
     <Sequence_Num>1</Sequence_Num>
  </Profile>
   <Profile Type="language">
     <Name>Francais</Name>
     <Sequence_Num>2</Sequence_Num>
   </Profile>
  </Language>
  <External>
   <Profile Type="software" Source="external">
     <Software_Id>EVA_VERSION</Software_Id>
      <Name>Eva DMS</Name>
      <Version>EVA PLUS 2020 SP01 - 19.03.20</Version>
      <Publisher>Keyloop Belgium</Publisher>
      <Install_Date>2020-03-19 23:08:58</Install_Date>
   </Profile>
   <Profile Type="software" Source="external">
     <Software_Id>EVA_VERSION</Software_Id>
      <Name>Eva DMS</Name>
      <Version>EVA PLUS 2020 SP01 - 08.04.20</Version>
      <Publisher>Keyloop Belgium</Publisher>
      <Install_Date>2020-04-08 23:08:58</Install_Date>
   </Profile>
   <Profile Type="software" Source="external">
     <Software_Id>EVA_VERSION</Software_Id>
      <Name>Eva DMS</Name>
      <Version>EVA PLUS 2020 SP07 - 22.10.20</Version>
      <Publisher>Keyloop Belgium</Publisher>
      <Install_Date>2020-10-22 23:09:10</Install_Date>
   </Profile>
   <Profile Type="software" Source="external">
     <Software_Id>EVA_VERSION</Software_Id>
      <Name>Eva DMS</Name>
      <Version>EVA PLUS 2020 SP11 - 12.04.21</Version>
      <Publisher>Keyloop Belgium</Publisher>
      <Install_Date>2021-04-12 23:09:18</Install_Date>
   </Profile>
   <Profile Type="software" Source="external">
     <Software_Id>EVA_VERSION</Software_Id>
      <Name>Eva DMS</Name>
      <Version>KEYLOOP EVA 2021 SP03 - 29.06.21</Version>
      <Publisher>Keyloop Belgium</Publisher>
      <Install_Date>2021-06-29 23:09:01</Install_Date>
   </Profile>
   <Profile Type="software" Source="external">
     <Software_Id>EVA_VERSION</Software_Id>
      <Name>Eva DMS</Name>
      <Version>KEYLOOP EVA 2021 SP07 - 02.12.21</Version>
      <Publisher>Keyloop Belgium</Publisher>
      <Install_Date>2021-12-02 14:40:37</Install_Date>
   </Profile>
   <Profile Type="software" Source="external">
     <Software_Id>EVA_VERSION</Software_Id>
      <Name>Eva DMS</Name>
      <Version>KEYLOOP EVA 2024.1 - 10.07.24</Version>
      <Publisher>Keyloop Belgium</Publisher>
      <Install_Date>2024-07-10 11:49:47</Install_Date>
   </Profile>
   <Profile Type="software" Source="external">
     <Software_Id>EVA_VERSION</Software_Id>
      <Name>Eva DMS</Name>
      <Version>KEYLOOP EVA 2024.2 - 28.11.24</Version>
      <Publisher>Keyloop Belgium</Publisher>
      <Install_Date>2024-11-28 12:14:50</Install_Date>
   </Profile>
   <Profile Type="software" Source="external">
     <Software_Id>EVA_VERSION</Software_Id>
      <Name>Eva DMS</Name>
      <Version>KEYLOOP EVA 2024.4 - 17.04.25</Version>
      <Publisher>Keyloop Belgium</Publisher>
      <Install_Date>2025-04-17 07:08:10</Install_Date>
   </Profile>
   <Profile Type="software" Source="external">
     <Software_Id>EVA_VERSION</Software_Id>
      <Name>Eva DMS</Name>
      <Version>KEYLOOP EVA 2024.4 - 17.04.25</Version>
      <Publisher>Keyloop Belgium</Publisher>
      <Install_Date>2025-04-17 08:00:22</Install_Date>
   </Profile>
    <Profile Type="software" Source="external">
      <Software_Id>UPDATE.DSK2018-04-2523:09:12</Software_Id>
      <Name>Update.dsk</Name>
      <Version>EVA PLUS 2018 SP02</Version>
      <Publisher>Keyloop Belgium</Publisher>
      <Install_Date>2018-04-25 23:09:12</Install_Date>
    </Profile>
    <Profile Type="software" Source="external">
      <Software_Id>UPDATE.DSK2018-12-1123:09:16</Software_Id>
      <Name>Update.dsk</Name>
      <Version>EVA PLUS 2018 SP09</Version>
      <Publisher>Keyloop Belgium</Publisher>
      <Install_Date>2018-12-11 23:09:16</Install_Date>
    </Profile>
    <Profile Type="software" Source="external">
      <Software_Id>UPDATE.DSK2019-08-2310:09:04</Software_Id>
      <Name>Update.dsk</Name>
      <Version>EVA PLUS 2019 SP03</Version>
      <Publisher>Keyloop Belgium</Publisher>
      <Install_Date>2019-08-23 10:09:04</Install_Date>
    </Profile>
    <Profile Type="software" Source="external">
      <Software_Id>UPDATE.DSK2019-08-2310:17:30</Software_Id>
      <Name>Update.dsk</Name>
      <Version>EVA PLUS 2019 SP03</Version>
      <Publisher>Keyloop Belgium</Publisher>
      <Install_Date>2019-08-23 10:17:30</Install_Date>
    </Profile>
    <Profile Type="software" Source="external">
      <Software_Id>UPDATE.DSK2019-08-2917:07:25</Software_Id>
      <Name>Update.dsk</Name>
      <Version>EVA PLUS 2019 SP03</Version>
      <Publisher>Keyloop Belgium</Publisher>
      <Install_Date>2019-08-29 17:07:25</Install_Date>
    </Profile>
    <Profile Type="software" Source="external">
      <Software_Id>UPDATE.DSK2019-09-0216:35:46</Software_Id>
      <Name>Update.dsk</Name>
      <Version>EVA-5575 - PLR</Version>
      <Publisher>Keyloop Belgium</Publisher>
      <Install_Date>2019-09-02 16:35:46</Install_Date>
    </Profile>
    <Profile Type="software" Source="external">
      <Software_Id>UPDATE.DSK2019-09-0216:36:04</Software_Id>
      <Name>Update.dsk</Name>
      <Version>EVA-5575 - PLR</Version>
      <Publisher>Keyloop Belgium</Publisher>
      <Install_Date>2019-09-02 16:36:04</Install_Date>
    </Profile>
    <Profile Type="software" Source="external">
      <Software_Id>UPDATE.DSK2019-11-0623:09:04</Software_Id>
      <Name>Update.dsk</Name>
      <Version>EVA PLUS 2019 SP07</Version>
      <Publisher>Keyloop Belgium</Publisher>
      <Install_Date>2019-11-06 23:09:04</Install_Date>
    </Profile>
    <Profile Type="software" Source="external">
      <Software_Id>UPDATE.DSK2021-12-0214:47:32</Software_Id>
      <Name>Update.dsk</Name>
      <Version>JAARAFSLUITING-CLOTURE DE L&#39;ANNEE</Version>
      <Publisher>Keyloop Belgium</Publisher>
      <Install_Date>2021-12-02 14:47:32</Install_Date>
    </Profile>
    <Profile Type="software" Source="external">
      <Software_Id>UPDATE.DSK2021-12-0214:48:09</Software_Id>
      <Name>Update.dsk</Name>
      <Version>JAARAFSLUITING-CLOTURE DE L&#39;ANNEE</Version>
      <Publisher>Keyloop Belgium</Publisher>
      <Install_Date>2021-12-02 14:48:09</Install_Date>
    </Profile>
   <Profile Type="software" Source="external">
     <Software_Id>EVA_VERSION</Software_Id>
      <Name>Eva DMS</Name>
      <Version>Keyloop Eva 2024.4 - 20.03.25</Version>
      <Publisher>Keyloop Belgium</Publisher>
      <Install_Date>2025-04-17 08:00:22</Install_Date>
   </Profile>
   <Profile Type="software" Source="external">
     <Software_Id>CACHE_LICENSE</Software_Id>
     <Version>202105171</Version>
     <Name>Cache Licence Key</Name>
     <Publisher>Keyloop Belgium</Publisher>
     <Install_Date/>
   </Profile>
   <Profile Type="software" Source="external">
     <Software_Id>EVA_LICENSE</Software_Id>
     <Version>1077712</Version>
     <Name>EVA Licence Key</Name>
     <Publisher>Keyloop Belgium</Publisher>
     <Install_Date>2016-06-30 00:00:00</Install_Date>
   </Profile>
   <Profile Type="software" Source="external">
     <Software_Id>EVA_LICENSE_USERS</Software_Id>
     <Version>5</Version>
     <Name>Number of Eva users</Name>
     <Publisher>Keyloop Belgium</Publisher>
     <Install_Date/>
   </Profile>
   <Profile Type="software" Source="external">
     <Software_Id>EVA_LICENSE_JOBS</Software_Id>
     <Version>0</Version>
     <Name>Number of Jobs</Name>
     <Publisher>Keyloop Belgium</Publisher>
     <Install_Date/>
   </Profile>
   <Profile Type="software" Source="external">
     <Software_Id>EVA_CACHE_LICENCES_OFFICIAL</Software_Id>
     <Version></Version>
     <Name>Official Cache Licences</Name>
     <Publisher>Keyloop Belgium</Publisher>
     <Install_Date/>
   </Profile>
   <Profile Type="software" Source="external">
     <Software_Id>EVA_CACHE_LICENCES_TOTAL</Software_Id>
     <Version>8</Version>
     <Name>Total Cache Licence</Name>
     <Publisher>Keyloop Belgium</Publisher>
     <Install_Date/>
   </Profile>
   <Profile Type="software" Source="external">
     <Software_Id>BU_FLAG</Software_Id>
     <Version>1</Version>
     <Name>BU Flag</Name>
     <Publisher>Keyloop Belgium</Publisher>
     <Install_Date/>
   </Profile>
   <Profile Type="software" Source="external">
     <Software_Id>TAPE_FLAG</Software_Id>
     <Version>1</Version>
     <Name>TAPE Flag</Name>
     <Publisher>Keyloop Belgium</Publisher>
     <Install_Date/>
   </Profile>
   <Profile Type="software" Source="external">
     <Software_Id>BU_OVERRIDE_FLAG</Software_Id>
     <Version>0</Version>
     <Name>BU_OVERRIDE Flag</Name>
     <Publisher>Keyloop Belgium</Publisher>
     <Install_Date/>
   </Profile>
   <Profile Type="software" Source="external">
     <Software_Id>TAPE_OVERRIDE_FLAG</Software_Id>
     <Version>1</Version>
     <Name>TAPE_OVERRIDE Flag</Name>
     <Publisher>Keyloop Belgium</Publisher>
     <Install_Date/>
   </Profile>
   <Profile Type="software" Source="external">
     <Software_Id>MULTICOMPANY</Software_Id>
     <Name>Multicompany Flag</Name>
     <Version>NO</Version>
     <Publisher>Keyloop DSI</Publisher>
     <Install_Date/>
   </Profile>
   <Profile Type="software" Source="external">
     <Software_Id>MULTISITE</Software_Id> 
     <Name>Multisite Flag</Name>
     <Version>NO</Version> 
     <Publisher>Keyloop DSI</Publisher> 
     <Install_Date/>
   </Profile>
   <Profile Type="software" Source="external">
     <Software_Id>MS_RE_PRX</Software_Id>
     <Name>Renault Price Update</Name> 
     <Version>27.05.25</Version>
     <Publisher>Keyloop Belgium</Publisher> 
     <Install_Date>2025-05-27 00:00:00</Install_Date>
   </Profile>
 </External>
 <ServieBox>
 </ServieBox>
 <ODBCConnecties>
  <ADP>
     <Connectie-1>
       <SysName>Unknown</SysName>
       <IPAdres>127.0.0.1</IPAdres>
       <UserID>127.0.0.1</UserID>
       <UserName>ADMCDK</UserName>
       <ExeName>CSTUDIO.EXE</ExeName>
       <Historiek>
         <Laatste_TimeStamp>17/04/2025 14:34:44,23381.938115</Laatste_TimeStamp>
         <TimeStamp-1>17/04/2025 13:53:44,20921.715851</TimeStamp-1>
       </Historiek>
     </Connectie-1>
     <Connectie-2>
       <SysName>Unknown</SysName>
       <IPAdres>unknown</IPAdres>
       <UserID>unknown</UserID>
       <UserName>Daemon</UserName>
       <ExeName>unknown</ExeName>
       <Historiek>
         <Laatste_TimeStamp>20/04/2025 08:00:48,32272.439694</Laatste_TimeStamp>
         <TimeStamp-1>20/04/2025 08:00:48,32272.439598</TimeStamp-1>
         <TimeStamp-2>20/04/2025 08:00:48,32272.439506</TimeStamp-2>
         <TimeStamp-3>20/04/2025 08:00:48,32272.439476</TimeStamp-3>
         <TimeStamp-4>20/04/2025 08:00:48,32272.439235</TimeStamp-4>
         <TimeStamp-5>20/04/2025 08:00:48,32272.439166</TimeStamp-5>
         <TimeStamp-6>20/04/2025 08:00:48,32272.439008</TimeStamp-6>
         <TimeStamp-7>20/04/2025 08:00:48,32272.438944</TimeStamp-7>
         <TimeStamp-8>20/04/2025 08:00:26,32250.707506</TimeStamp-8>
         <TimeStamp-9>20/04/2025 08:00:26,32250.684962</TimeStamp-9>
         <TimeStamp-10>20/04/2025 08:00:26,32250.665622</TimeStamp-10>
         <TimeStamp-11>20/04/2025 08:00:26,32250.646521</TimeStamp-11>
         <TimeStamp-12>20/04/2025 08:00:26,32250.627516</TimeStamp-12>
         <TimeStamp-13>20/04/2025 08:00:26,32250.607928</TimeStamp-13>
         <TimeStamp-14>20/04/2025 08:00:26,32250.592248</TimeStamp-14>
         <TimeStamp-15>20/04/2025 08:00:26,32250.576217</TimeStamp-15>
         <TimeStamp-16>20/04/2025 08:00:23,32247.939663</TimeStamp-16>
         <TimeStamp-17>20/04/2025 08:00:23,32247.917602</TimeStamp-17>
         <TimeStamp-18>20/04/2025 08:00:23,32247.891272</TimeStamp-18>
         <TimeStamp-19>20/04/2025 08:00:23,32247.86969</TimeStamp-19>
       </Historiek>
     </Connectie-2>
     <MaxConnecties-ADP>2</MaxConnecties-ADP>
     <DetailJobs-ADP>
        <Detail-20250417>
          <Start>8;6;8;5;1;2;16;8;6;6;2;16;11;1;1</Start>
          <Stop>8;5;3;1;5;1;16;8;6;2;2;11;14;1;1</Stop>
          <Totaal>97;84;13</Totaal>
          <HangendeJobs>13;13</HangendeJobs>
          <MaxJobs>27</MaxJobs>
          <MaxQueryTime>84512.401612(23:28:32);84486.288656(23:28:06);84485.925964(23:28:05);84485.9259(23:28:05);84485.925849(23:28:05);84485.925833(23:28:05);57233.006978(15:53:53);57233.006936(15:53:53);57224.53305(15:53:44);57217.469618(15:53:37);57217.469546(15:53:37);29212.373324(08:06:52);1914.168907(00:31:54);1690.016612(00:28:10);51.426321;51.426313;46.380736;46.380514;42.423471;39.408579;37.913949;37.906687;31.452238;31.452115;30.843263;30.842928;27.570565;27.570426;27.570393;26.075834;</MaxQueryTime>
        </Detail-20250417>
        <Detail-20250420>
          <Start>16;7</Start>
          <Stop>10;6</Stop>
          <Totaal>23;16;7</Totaal>
          <HangendeJobs>7;7</HangendeJobs>
          <MaxJobs>16</MaxJobs>
          <MaxQueryTime>54151.190829(15:02:31);54151.130859(15:02:31);54148.373054(15:02:28);54148.35384(15:02:28);54126.562145(15:02:06);54126.562111(15:02:06);54126.562096(15:02:06);54126.562007(15:02:06);32274.763279(08:57:54);24.171402;24.155766;21.022858;20.983347;20.963992;20.922212;20.895918;20.872599;18.236037;18.146866;18.126538;18.103941;2.325343;2.325279;2.325151;</MaxQueryTime>
        </Detail-20250420>
     </DetailJobs-ADP>
  </ADP>
 </ODBCConnecties>
 <STUErrors>
 </STUErrors>
 <Errors>
   <ADP>
     <Error>31.05.25\20 h 00\ -  [$j:7072] \|UNDEFINED|21+7^Y8748 *%SCKT\R</Error>
     <Aantal>14</Aantal>
     <Error>10.05.25\11 h 40\50010 - PrintDupliVoorschotFact [$j:5740] \|UNDEFINED|6+11^Y2010 *F80\R</Error>
     <Aantal>1</Aantal>
     <Error>20.05.25\15 h 08\50028 - GetFacHeaderKeys [$j:6764] \|UNDEFINED|HD^YDG120 *KC\R</Error>
     <Aantal>1</Aantal>
   </ADP>
 </Errors>
</Document>
